Business Name,Type,Priority Tier,Priority Score,AI Readiness Score,Data Completeness %,Multi-Location,Location Count,Area,Tech Park,Building,HQ Location,Business Category,Description,Website,Phone,Email,LinkedIn,Has Direct Contact,Employee Count,Revenue Range,Google Rating,Primary Persona,Decision Maker Persona,Persona Title,Persona Pain Points,Persona Goals,AI Value Proposition,AI Pitch Script,AI Pitch Opportunity,AI Use Case,AI Maturity,Tech Stack,Decision Making Process,Budget Authority,Engagement Strategy,Contact Priority,Last Enriched,Competitors,Recent News,_research_query,_enriched_website,_enriched_linkedin,_enriched_emails,_enriched_phones,_research_sources,_search_engine_used,_research_error,_research_timestamp,_page_description,_page_facebook,_page_twitter,_page_instagram,_page_youtube,_page_github,_page_contact_url,_page_about_url,_page_careers_url,_page_blog_url,_page_tech_stack,_page_founded_year,_page_employee_count,_page_headquarters,_firmographic_query,_firmographic_sources,_firmographic_errors,legal_name,registration_number,jurisdiction,incorporation_date,company_status,company_type,official_website,industry,sic_code,employee_count,headquarters,officers
ABB Global,Enterprise / Tech Company,Tier 2 - Warm,75,65,89,No,1,HITEC City,Cyber Pearl,Block 1,"Zurich, Switzerland",Industrial Automation,"Swedish-Swiss multinational corporation in robotics, automation, power",https://www.abb.com,+91 40 1234 5678,,https://linkedin.com/company/abb,Yes,"105,000+",$30B+,4.2,CTO - Industrial AI,CTO - Industrial AI,,,,,,"AI robotics, predictive maintenance, energy optimization",Very High - AI in industry,,,,,,,,"Siemens, Rockwell, Schneider",Industrial AI center in Hyderabad,,https://www.abb.com,https://linkedin.com/company/abb,,,,,,2026-06-30T11:03:10.091513,,,,,,,,,,,,,,,ABB Global,,OpenCorporates:401 Client Error: Unauthorized for url: https://api.opencorporates.com/v0.4/companies/search?q=ABB+Global&per_page=5,,,,,,,,,,,,
ADP India,Enterprise / Tech Company,Tier 2 - Warm,75,65,89,No,1,HITEC City,Laxmi Cyber City,Main,"Roseland, USA",HR Tech / Payroll,Global provider of human capital management solutions,https://www.adp.com,+91 40 1234 5678,,https://linkedin.com/company/adp,Yes,"60,000+",$17B+,4.1,VP - AI HR Tech,VP - AI HR Tech,,,,,,"AI payroll, talent analytics, HR automation",High - AI in HR,,,,,,,,"Workday, SAP, Oracle",AI-powered HR analytics platform,,https://www.adp.com,https://linkedin.com/company/adp,,,,,,2026-06-30T11:03:22.488962,"ADP offers industry-leading online payroll and HR solutions, plus tax, compliance, benefit administration and more.",https://www.facebook.com/AutomaticDataProcessing,https://twitter.com/adp,,https://www.youtube.com/user/adp,,https://www.adp.com/contact-us/customer-service.aspx,https://www.adp.com/about-adp.aspx,https://jobs.adp.com/?rb=ADP_COM,https://www.adp.com/spark.aspx,,,49,,ADP India,,OpenCorporates:401 Client Error: Unauthorized for url: https://api.opencorporates.com/v0.4/companies/search?q=ADP+India&per_page=5,,,,,,,,,,,,
AMD,Enterprise / Tech Company,Tier 2 - Warm,75,65,89,No,1,HITEC City,Mindspace Madhapur,Building 11,"Santa Clara, USA",Semiconductor,Designs and integrates technology that powers millions of devices,https://www.amd.com,+91 40 1234 5678,,https://linkedin.com/company/amd,Yes,"25,000+",$23B+,4.3,VP Engineering - AI Acceleration,VP Engineering - AI Acceleration,,,,,,"AI chip design, GPU for ML, data center AI",Very High - AI hardware focus,,,,,,,,"NVIDIA, Intel, Qualcomm",Hyderabad team works on AI chip architecture,,https://www.amd.com,https://linkedin.com/company/amd,,,,,,2026-06-30T11:03:23.248541,,,,,,,,,,,,,,,AMD,SEC_EDGAR; Wikidata,OpenCorporates:401 Client Error: Unauthorized for url: https://api.opencorporates.com/v0.4/companies/search?q=AMD&per_page=5,Ahmedabad,0000906345,India,,,,https://ahmedabadcity.gov.in/,,,,,
Accenture,Enterprise / Tech Company,Tier 1 - Hot,100,100,100,No,1,HITEC City,Mindspace Madhapur,Building 1A,"Dublin, Ireland",IT Consulting & Services,"Global professional services company providing strategy, consulting, digital, technology, and operations services",https://www.accenture.com,+91 40 6692 0000,hdc.mailroom@accenture.com,https://linkedin.com/company/accenture,Yes,"775,000+",$64B+,4.0,CTO - Cloud & AI Transformation,CTO - Cloud & AI Transformation,Chief Technology Officer,"Scaling AI across global teams, legacy modernization, talent shortage","Drive digital transformation, reduce costs, accelerate innovation","AI copilots for 775K employees, generative AI for client delivery, automated code generation","'Accenture is investing $3B in AI. We can help you deploy AI copilots across your 100K+ workforce, reducing project delivery time by 40% and cutting costs by 25%.'","AI-powered automation, generative AI for client delivery",High - AI at core of strategy,Advanced - AI at core,"Azure, AWS, GCP, Salesforce, SAP","C-suite driven, 6-12 month cycles, ROI-focused",High - $100M+ AI budgets,"Executive briefings, POCs, case studies, industry events",Hot - Immediate AI need,2025-01-15,"Deloitte, TCS, Infosys",Launched AI Center of Excellence in Hyderabad,,https://www.accenture.com,https://linkedin.com/company/accenture,hdc.mailroom@accenture.com,+91 40 6692 0000,,,,2026-06-30T11:03:29.339745,"Accenture embraces the power of change to create 360° value and shared success for our clients, people, shareholders, partners and communities. Learn more.",https://www.facebook.com/AccentureIndia,,https://www.instagram.com/accentureindiacareers,https://www.youtube.com/channel/UCi7os4F3cWKPOWCOtmv562A,,https://www.accenture.com/in-en/about/contact-us,https://www.accenture.com/in-en/about/company-index,https://www.accenture.com/in-en/careers,https://newsroom.accenture.com,,,,,Accenture,SEC_EDGAR; Wikidata,OpenCorporates:401 Client Error: Unauthorized for url: https://api.opencorporates.com/v0.4/companies/search?q=Accenture&per_page=5,Accenture,0001467373,Ireland,,,,https://www.accenture.com/,information technology,,779000,Dublin,
AdvanSoft India,Enterprise / Tech Company,Tier 2 - Warm,65,65,78,No,1,HITEC City,Cyber Towers,Q4,"Hyderabad, India",Software,Software development and services,,+91 40 1234 5678,,,Yes,,,4.0,Director - AI Products,Director - AI Products,,,,,,"AI software development, product engineering",Medium - AI products,,,,,,,,"Infosys, TCS, Wipro",AI product development,"""AdvanSoft India"" HITEC City",,,,,https://namu.wiki/w/%EC%9C%A0%ED%8A%9C%EB%B8%8C; https://www.naver.com/; https://forum.vivaldi.net/topic/113545/whatsapp.com-web-use-another-browser-browser-unsupported-for-whatsapp-web; https://forum.vivaldi.net/topic/112404/whatsapp-web-logging-out-constantly; https://answers.microsoft.com/zh-hans/windows/forum/windows_10-windows_install-winpc/如何恢复上/428e587e-2e87-4745-83be-2f62303c4a5d,"DDGSearchProvider,SearXNGProvider",,2026-06-30T11:03:38.199160,,,,,,,,,,,,,,,AdvanSoft India,,OpenCorporates:401 Client Error: Unauthorized for url: https://api.opencorporates.com/v0.4/companies/search?q=AdvanSoft+India&per_page=5,,,,,,,,,,,,
AheadRace Software,Enterprise / Tech Company,Tier 2 - Warm,65,65,78,No,1,Gachibowli,Kapil Towers,Main,"Hyderabad, India",Software,Software development services,,+91 40 1234 5678,,,Yes,,,4.0,Director - AI Engineering,Director - AI Engineering,,,,,,"AI software development, product engineering",Medium - AI engineering,,,,,,,,"TCS, Infosys, Wipro",AI software delivery,"""AheadRace Software"" Gachibowli",,,,,https://alphasquare.co.kr/home/stock-summary?code=000660; https://kr.investing.com/equities/sk-hynix-inc; https://sk.moneyjoopjoop.com/; https://kr.investing.com/equities/sk-hynix-inc-chart; https://hlkr.co.kr/stocks/skhx,"DDGSearchProvider,SearXNGProvider",,2026-06-30T11:03:50.759009,,,,,,,,,,,,,,,AheadRace Software,,OpenCorporates:401 Client Error: Unauthorized for url: https://api.opencorporates.com/v0.4/companies/search?q=AheadRace+Software&per_page=5,,,,,,,,,,,,
Amazon,Enterprise / Tech Company,Tier 1 - Hot,100,100,89,No,1,HITEC City,Mindspace Madhapur,Building 4,"Seattle, USA",E-commerce / Cloud,World's largest e-commerce and cloud computing company (AWS),https://www.amazon.com,+91 40 1234 5678,,https://linkedin.com/company/amazon,Yes,1.5M+,$500B+,4.1,Principal Engineer - AI/ML,Principal Engineer - AI/ML,Principal Engineer - AI/ML,"Scaling AI infrastructure, real-time recommendation latency, personalization at scale","Increase conversion by 20%, reduce AWS AI costs by 30%, enable new AI services","AI-powered recommendation engines, real-time personalization, AWS AI service optimization","'Amazon processes 1M+ transactions per second. Our AI can reduce recommendation latency by 50% and increase conversion rates by 15%, adding $5B+ in revenue.'","Alexa AI, recommendation engines, AWS AI services",Very High - AI everywhere,Very Advanced - AI everywhere,"AWS, TensorFlow, MXNet, custom chips","Engineering + Product, data-driven, A/B testing culture",Very High - $10B+ AI budget,"Technical papers, benchmark data, internal demos",Warm - Internal AI teams,2025-01-15,"Microsoft, Google, Flipkart",Expanding Hyderabad development center,,https://www.amazon.com,https://linkedin.com/company/amazon,,,,,,2026-06-30T11:04:02.928721,"Free shipping on millions of items. Get the best of Shopping and Entertainment with Prime. Enjoy low prices and great deals on the largest selection of everyday essentials and other products, including fashion, home, beauty, electronics, Alexa Devices, sporting goods, toys, automotive, pets, baby, books, video games, musical instruments, office supplies, and more.",,,,,,,https://blog.aboutamazon.com/?utm_source=gateway&utm_medium=footer,https://www.amazon.jobs,https://blog.aboutamazon.com/?utm_source=gateway&utm_medium=footer,,,,,Amazon,SEC_EDGAR; Wikidata,OpenCorporates:401 Client Error: Unauthorized for url: https://api.opencorporates.com/v0.4/companies/search?q=Amazon&per_page=5,Amazon,0001018724,Brazil,,,,https://www.sec.gov/cgi-bin/browse-edgar?action=getcompany&CIK=0001018724,,,,,
Aspire Systems,Enterprise / Tech Company,Tier 2 - Warm,75,65,89,No,1,Gachibowli,Divyasree Orion,Block B5,"Chennai, India",IT Services,Technology outsourcing and product engineering,https://www.aspiresys.com,+91 40 1234 5678,,https://linkedin.com/company/aspire-systems,Yes,,,4.0,CTO - AI Engineering,CTO - AI Engineering,,,,,,"AI engineering, product development, cloud AI",Medium - AI engineering,,,,,,,,"TCS, Infosys, Wipro",AI product engineering,,https://www.aspiresys.com,https://linkedin.com/company/aspire-systems,,,,,,2026-06-30T11:04:09.135268,"Aspire Systems provides comprehensive IT services, IT consulting expertise, and technology solutions to help businesses achieve their digital transformation goals.",https://www.facebook.com/AspireSystems,https://twitter.com/aspiresystems,https://www.instagram.com/aspire_systems,https://www.youtube.com/c/Aspiresys,,https://www.aspiresys.com/contact-us?en,https://www.aspiresys.com/en/about-us,https://www.aspiresys.com/pl-careers,https://www.aspiresys.com/newsroom,Drupal,,,,Aspire Systems,Wikidata,OpenCorporates:401 Client Error: Unauthorized for url: https://api.opencorporates.com/v0.4/companies/search?q=Aspire+Systems&per_page=5,Aspire Systems,,,,,,http://www.aspiresys.com/,,,,Chennai,
BA Continuum,Enterprise / Tech Company,Tier 2 - Warm,75,65,89,No,1,HITEC City,Mindspace Madhapur,Building 9,"Charlotte, USA",BFSI / IT Services,Bank of America subsidiary providing IT and business process outsourcing services,https://www.bankofamerica.com,+91 40 1234 5678,,https://linkedin.com/company/bank-of-america,Yes,,,4.0,SVP Technology - Digital Banking,SVP Technology - Digital Banking,,,,,,"AI fraud detection, customer analytics, robo-advisory",High - BFSI AI adoption,,,,,,,,"JPMorgan, Wells Fargo, HSBC",Implementing AI for loan processing,,https://www.bankofamerica.com,https://linkedin.com/company/bank-of-america,,,,,,2026-06-30T11:04:21.530273,"What would you like the power to do? At Bank of America, our purpose is to help make financial lives better through the power of every connection.",,,,,,https://www.bankofamerica.com/customer-service/contact-us,https://www.bankofamerica.com/online-banking/iphone-banking-app.go,,,Angular; Salesforce,,,Email Address *,BA Continuum,,OpenCorporates:401 Client Error: Unauthorized for url: https://api.opencorporates.com/v0.4/companies/search?q=BA+Continuum&per_page=5,,,,,,,,,,,,
BA Continuum India,Enterprise / Tech Company,Tier 2 - Warm,75,65,89,No,1,HITEC City,Mindspace Madhapur,Building 5,"Hyderabad, India",BFSI / IT,IT and operations subsidiary of Bank of America,https://www.bankofamerica.com,+91 40 1234 5678,,https://linkedin.com/company/bank-of-america,Yes,,,4.0,SVP - AI Operations,SVP - AI Operations,,,,,,"Process automation, AI compliance, predictive analytics",High - AI in operations,,,,,,,,"Wells Fargo, JPMorgan",Expanding AI team in Hyderabad,,https://www.bankofamerica.com,https://linkedin.com/company/bank-of-america,,,,,,2026-06-30T11:04:28.481527,"What would you like the power to do? At Bank of America, our purpose is to help make financial lives better through the power of every connection.",,,,,,https://www.bankofamerica.com/customer-service/contact-us,https://www.bankofamerica.com/online-banking/iphone-banking-app.go,,,Angular; Salesforce,,,Email Address *,BA Continuum India,,OpenCorporates:401 Client Error: Unauthorized for url: https://api.opencorporates.com/v0.4/companies/search?q=BA+Continuum+India&per_page=5,,,,,,,,,,,,
Berkadia,Enterprise / Tech Company,Tier 2 - Warm,75,65,89,No,1,Gachibowli,DLF Cyber City,Block 2,"Ambler, USA",Real Estate / Financial,Joint venture of Berkshire Hathaway and Jefferies Financial Group,https://www.berkadia.com,+91 40 1234 5678,,https://linkedin.com/company/berkadia,Yes,,,4.0,VP - PropTech AI,VP - PropTech AI,,,,,,"AI real estate analytics, investment modeling",Medium - AI in real estate,,,,,,,,"CBRE, JLL, Cushman",Real estate AI analytics,,https://www.berkadia.com,https://linkedin.com/company/berkadia,,,,,,2026-06-30T11:04:35.597885,Your top choice for premier commercial real estate services and mortgage solutions. We deliver expertly tailored solutions for exceptional results.,https://www.facebook.com/berkadia,https://x.com/Berkadia,https://www.instagram.com/berkadia,,,https://www.berkadia.com/contact,https://www.berkadia.com/aboutus/newsroom,https://www.berkadia.com/careers,https://www.berkadia.com/aboutus/newsroom,WordPress,,,,Berkadia,Wikidata,OpenCorporates:401 Client Error: Unauthorized for url: https://api.opencorporates.com/v0.4/companies/search?q=Berkadia&per_page=5,Berkadia,,United States,,,,https://berkadia.com/,commercial property,,,,
CGI,Enterprise / Tech Company,Tier 2 - Warm,75,65,89,No,1,Gachibowli,DLF Cyber City,Block 2,"Montreal, Canada",IT Consulting,Canadian IT consulting and outsourcing services,https://www.cgi.com,+91 40 1234 5678,,https://linkedin.com/company/cgi,Yes,"90,000+",$12B+,4.0,VP - AI Consulting,VP - AI Consulting,,,,,,"AI consulting, enterprise AI, automation",High - AI consulting,,,,,,,,"Accenture, Deloitte, Capgemini",AI consulting practice,,https://www.cgi.com,https://linkedin.com/company/cgi,,,,,,2026-06-30T11:04:43.956007,"Since 1976, CGI has grown into one of the largest IT and business consulting services firms in the world. Our 50-year milestone celebrates a history of serving clients and creating a global culture of ownership, always with a focus on looking to the future ahead.",https://www.facebook.com/cgigroup,https://twitter.com/cgi_global,,https://www.youtube.com/watch,https://github.com/newrelic,https://www.cgi.com/en/contact-us,https://www.cgi.com/en/about-us/insights,https://www.cgi.com#mm-11,https://www.cgi.com/en/blogs,Drupal,1976.0,,,CGI,SEC_EDGAR; Wikidata,OpenCorporates:401 Client Error: Unauthorized for url: https://api.opencorporates.com/v0.4/companies/search?q=CGI&per_page=5,Common Gateway Interface,0001061574,United States,,,,https://www.sec.gov/cgi-bin/browse-edgar?action=getcompany&CIK=0001061574,,,,,
Cambridge Technology,Enterprise / Tech Company,Tier 2 - Warm,75,65,89,No,1,HITEC City,Cyber Pearl,Block 1,"Cambridge, USA",IT Services,Technology services and solutions provider,https://www.cambridgeonline.com,+91 40 1234 5678,,https://linkedin.com/company/cambridge-technology,Yes,,,4.0,Director - Cloud AI,Director - Cloud AI,,,,,,"Cloud-native AI, data engineering, ML ops",Medium - AI services,,,,,,,,"Infosys, TCS, Wipro",Cloud and AI solutions,,https://www.cambridgeonline.com,https://linkedin.com/company/cambridge-technology,,,,,,2026-06-30T11:05:19.927574,,,,,,,,,,,,,,,Cambridge Technology,Wikidata,OpenCorporates:401 Client Error: Unauthorized for url: https://api.opencorporates.com/v0.4/companies/search?q=Cambridge+Technology&per_page=5,Cambridge Technology Partners,,Japan,,,,http://www.ctp.co.jp/,business and other management consultancy activities,,,Nyon,
CipherCloud,Enterprise / Tech Company,Tier 2 - Warm,75,65,89,No,1,HITEC City,Cyber Pearl,Block 2,"San Jose, USA",Cybersecurity,Cloud security and encryption solutions,https://www.ciphercloud.com,+91 40 1234 5678,,https://linkedin.com/company/ciphercloud,Yes,,,4.0,CTO - AI Security,CTO - AI Security,,,,,,"AI threat detection, cloud security analytics",Medium - AI security,,,,,,,,"Palo Alto, McAfee, Symantec",Cloud AI security R&D,,https://www.ciphercloud.com,https://linkedin.com/company/ciphercloud,,,,,,2026-06-30T11:05:21.064903,,,,,,,,,,,,,,,CipherCloud,Wikidata,OpenCorporates:401 Client Error: Unauthorized for url: https://api.opencorporates.com/v0.4/companies/search?q=CipherCloud&per_page=5,CipherCloud,,United States,,,,http://www.ciphercloud.com/,software industry,,,San Jose,
Cognizant,Enterprise / Tech Company,Tier 1 - Hot,100,100,89,Yes,2,Gachibowli | HITEC City,DLF Cyber City | Mindspace Madhapur,Block 1 | Building 12A,"Teaneck, USA",IT Consulting / Services,"Multinational technology company providing IT services, consulting, business process outsourcing",https://www.cognizant.com,+91 40 1234 5678,,https://linkedin.com/company/cognizant,Yes,"350,000+",$19B+,4.0,SVP - AI & Digital Engineering,SVP - AI & Digital Engineering,SVP - AI & Digital Engineering,"AI talent shortage, client AI readiness, margin pressure from AI automation","Lead AI services market, 50% revenue from AI by 2030, top AI talent","Neuro AI platform, generative AI for clients, AI automation at scale",'Cognizant serves 2000+ clients. Our Neuro AI can automate 40% of software development tasks and reduce time-to-market by 50%.',"Neuro AI platform, generative AI for clients, automation",Very High - AI-first strategy,Advanced - AI-first strategy,"Azure, AWS, GCP, Salesforce, SAP","Client-driven, solution sales, quarterly business reviews",High - $200M+ AI budget,"Client workshops, POCs, industry conferences, analyst briefings",Hot - AI services growth,2025-01-15,"TCS, Infosys, Wipro",Launched AI lab in Hyderabad,,https://www.cognizant.com,https://linkedin.com/company/cognizant,,,,,,2026-06-30T11:05:31.073082,Anticipate trends. Drive meaningful change. Outthink your competition. That’s the power of intuition—and we can engineer it. Learn more.,https://www.facebook.com/Cognizant,https://twitter.com/cognizant,https://www.instagram.com/cognizant,https://www.youtube.com/iframe_api,,https://www.cognizant.com/in/en/about-cognizant/contact-us,https://www.cognizant.com/in/en/about-cognizant/responsible-ai,https://www.cognizant.com/in/en/careers,https://news.cognizant.com,,,,,Cognizant,SEC_EDGAR; Wikidata,OpenCorporates:401 Client Error: Unauthorized for url: https://api.opencorporates.com/v0.4/companies/search?q=Cognizant&per_page=5,Cognizant Technology Solutions,0001058290,United States,,,,https://www.cognizant.com,information technology industry,,266200,Teaneck,
Cybage Software,Enterprise / Tech Company,Tier 2 - Warm,75,65,89,No,1,Gachibowli,DLF Cyber City,Block 2,"Pune, India",IT Services,Software engineering and technology consulting,https://www.cybage.com,+91 40 1234 5678,Finance_Brazil@cybage.com,https://linkedin.com/company/cybage,Yes,,,4.0,VP - AI Engineering,VP - AI Engineering,,,,,,"AI software development, data science",Medium - AI engineering,,,,,,,,"Infosys, TCS, Wipro",AI engineering services,,https://www.cybage.com,https://linkedin.com/company/cybage,Finance_Brazil@cybage.com; Finance_Poland@cybage.com; Whistleblower@cybage.com; business@cybage.com,+91 8530109729; 6966554126,,,,2026-06-30T11:05:38.311128,"Cybage, with over 7500 employees, is a leader in outsourced product engineering and technology consulting. The firm excels in leveraging advanced technologies like AI, ML, and cloud services to help 280+ clients reach their digital transformation goals.",https://www.facebook.com/cybage,https://twitter.com/cybagesoftware,https://www.instagram.com/cybage,https://www.youtube.com/user/cybagesoftware,,https://www.cybage.com/contact-us,https://www.cybage.com/about-us,https://www.cybage.com/careers,https://www.cybage.com/about-us/newsroom,Drupal,1995.0,,,Cybage Software,,OpenCorporates:401 Client Error: Unauthorized for url: https://api.opencorporates.com/v0.4/companies/search?q=Cybage+Software&per_page=5,,,,,,,,,,,,
DIGITALOPS,AI Marketing Agency,Tier 1 - Hot,100,100,100,No,1,"Madhapur, HITEC City",,,"Madhapur, HITEC City",Digital Marketing / AI Agency,"SEO, Google Ads, Social Media, Content Marketing, Performance Marketing",https://www.digitalops.in,+91 9966 001212,hello@digitalops.in,https://linkedin.com/company/digitalops,Yes,25-50,,4.5,Founder / CEO / Growth Head,,CEO / Founder,"Scaling AI services, client AI education, talent acquisition","Become top AI marketing agency in Hyderabad, 100+ AI clients by 2027","AI-powered SEO, predictive lead scoring, automated ad management",'DIGITALOPS generated 80K+ leads with AI. We can help you achieve 3x ROI on marketing spend using our AI campaign optimization.',"AI SEO optimization, predictive lead scoring, automated ad management","AI-driven campaign optimization, predictive analytics, automated bidding",Intermediate - AI in marketing,"Google Ads, Meta, HubSpot, SEMrush, Ahrefs","Founder-led, agile, monthly reviews, performance-based",Medium - ₹1-5M AI budgets,"Performance demos, case studies, free AI audits",Hot - AI marketing demand,2025-01-15,,AI-powered ROI tracking with real-time dashboards,,https://www.digitalops.in,https://linkedin.com/company/digitalops,hello@digitalops.in,+91 9966 001212,,,,2026-06-30T11:05:44.819444,"DIGITALOPS - Best Digital Marketing Agency in Hyderabad offering expert SEO, PPC & Google Ads services. Grow your traffic and leads with proven strategies.",https://www.facebook.com/digitalopsagency,https://x.com/digitalops_in,https://www.instagram.com/digitalopsagency,https://www.youtube.com/channel/UCr1fdCto9dVVeWpCcd-okxQ,,https://digitalops.in/contact-us,https://digitalops.in/about-digitalops-agency,,https://digitalops.in/blog,WordPress,,,,DIGITALOPS,,OpenCorporates:401 Client Error: Unauthorized for url: https://api.opencorporates.com/v0.4/companies/search?q=DIGITALOPS&per_page=5,,,,,,,,,,,,
DXC Technology,Enterprise / Tech Company,Tier 2 - Warm,75,65,89,No,1,Gachibowli,DLF Cyber City,Block 2,"Tysons, USA",IT Services,Global IT services and consulting,https://www.dxc.com,+91 40 1234 5678,,https://linkedin.com/company/dxc-technology,Yes,"130,000+",$17B+,4.0,CTO - AI & Cloud,CTO - AI & Cloud,,,,,,"AI cloud solutions, enterprise AI, automation",High - AI in enterprise,,,,,,,,"IBM, Accenture, Cognizant",Enterprise AI delivery,,https://www.dxc.com,https://linkedin.com/company/dxc-technology,,,,,,2026-06-30T11:05:54.525613,"DXC is a leading enterprise technology and innovation partner delivering software, services, and solutions for global enterprises and public sector organizations.",,,https://www.instagram.com/dxctechnology,https://www.youtube.com/@DXCTechnology,,https://www.dxc.com/contact-us,https://www.dxc.com/about-us,https://careers.dxc.com,https://www.dxc.com/newsroom/04282026-dxc-introduces-dxc-oasis-to-reimagine-managed-services-for-the-ai-era,,,"115,000+",,DXC Technology,SEC_EDGAR; Wikidata,OpenCorporates:401 Client Error: Unauthorized for url: https://api.opencorporates.com/v0.4/companies/search?q=DXC+Technology&per_page=5,IndyCar Series at Texas Motor Speedway,0001688568,United States,,,,https://www.sec.gov/cgi-bin/browse-edgar?action=getcompany&CIK=0001688568,,,,,
Data Glove IT Solutions,Enterprise / Tech Company,Tier 2 - Warm,65,65,78,No,1,Gachibowli,Kapil Towers,Main,"Hyderabad, India",IT Services,IT solutions and services provider,,+91 40 1234 5678,,,Yes,,,4.0,CEO - AI Solutions,CEO - AI Solutions,,,,,,"AI data solutions, analytics, automation",Medium - AI data,,,,,,,,"TCS, Infosys, Wipro",Data AI services,"""Data Glove IT Solutions"" Gachibowli",,,,,https://data.gov/; https://www.kaggle.com/datasets; https://www.ibm.com/think/topics/data; https://www.geeksforgeeks.org/data-analysis/what-is-data/; https://www.merriam-webster.com/dictionary/data,"DDGSearchProvider,SearXNGProvider",,2026-06-30T11:06:07.448113,,,,,,,,,,,,,,,Data Glove IT Solutions,,OpenCorporates:401 Client Error: Unauthorized for url: https://api.opencorporates.com/v0.4/companies/search?q=Data+Glove+IT+Solutions&per_page=5,,,,,,,,,,,,
